{
 "schema_version": "8ball-answer/1",
 "plan_id": 900001,
 "scale": 1.0,
 "nodes": [
  {
   "node_id": "N1",
   "room_id": "living_0",
   "point": [
    1.95,
    2.0
   ]
  },
  {
   "node_id": "N2",
   "room_id": "bedroom_0",
   "point": [
    6.05,
    2.0
   ]
  }
 ],
 "hubs": [
  {
   "hub_id": "H1",
   "point": [
    1.0,
    1.97
   ],
   "room_id": "living_0",
   "room_ids": [
    "living_0",
    "bedroom_0"
   ],
   "node_ids": [
    "N1",
    "N2"
   ],
   "sequence": [
    "H1",
    "N1",
    "N2",
    "H1"
   ],
   "legs": [
    {
     "from": "H1",
     "to": "N1",
     "polyline": [
      [
       1.0,
       1.97
      ],
      [
       1.0,
       2.0
      ],
      [
       1.95,
       2.0
      ]
     ]
    },
    {
     "from": "N1",
     "to": "N2",
     "polyline": [
      [
       1.95,
       2.0
      ],
      [
       6.05,
       2.0
      ]
     ]
    },
    {
     "from": "N2",
     "to": "H1",
     "polyline": [
      [
       6.05,
       2.0
      ],
      [
       6.05,
       1.97
      ],
      [
       1.0,
       1.97
      ]
     ]
    }
   ],
   "area_m2": 31.2,
   "length_m": 10.16
  }
 ],
 "metrics": {
  "H": 1,
  "L": 10.16,
  "X": 0,
  "O": 0.0,
  "B": 4,
  "J": 12.16
 },
 "meta": {
  "solver": "fixture",
  "runtime_s": 0.0,
  "config_hash": "fixture",
  "seed": 0,
  "best_additive_cost": null,
  "min_hubs_bound": null,
  "j_floor": null
 }
}